[
  {
    "uri": "oea://amsterdam/relationship/current-close-match-gemma",
    "type": "oea://relationship-type/close-match",
    "from": "oea://amsterdam/application/current-case-system",
    "to": "gemma://reference-component/case-registration",
    "description": "De Amsterdamse afbakening is breder, maar ligt dicht bij de GEMMA-referentie."
  },
  {
    "uri": "oea://amsterdam/relationship/legacy-replaced-by-new",
    "type": "oea://relationship-type/replaced-by",
    "from": "oea://amsterdam/application/legacy-case-system",
    "to": "oea://amsterdam/application/new-case-platform"
  }
]
